18:40:19.040813 IP 10.244.1.2 > dns.google: ICMP echo request, id 14, seq 1, length 64
18:40:20.039905 IP 10.244.1.2 > dns.google: ICMP echo request, id 14, seq 2, length 64
18:40:21.041246 IP 10.244.1.2 > dns.google: ICMP echo request, id 14, seq 3, length 64
18:40:22.042546 IP 10.244.1.2 > dns.google: ICMP echo request, id 14, seq 4, length 64
18:40:23.043650 IP 10.244.1.2 > dns.google: ICMP echo request, id 14, seq 5, length 64
18:40:24.045276 IP 10.244.1.2 > dns.google: ICMP echo request, id 14, seq 6, length 64
18:40:25.046835 IP 10.244.1.2 > dns.google: ICMP echo request, id 14, seq 7, length 64
18:40:26.048227 IP 10.244.1.2 > dns.google: ICMP echo request, id 14, seq 8, length 64
18:40:27.049603 IP 10.244.1.2 > dns.google: ICMP echo request, id 14, seq 9, length 64
18:40:28.049072 IP 10.244.1.2 > dns.google: ICMP echo request, id 14, seq 10, length 64
